<?xml version="1.0" encoding="UTF-8"?>
<dataroot xmlns:od="urn:schemas-microsoft-com:officedata" xmlns:xsi="http://www.w3.org/2001/XMLSchema-instance"  xsi:noNamespaceSchemaLocation="Armor.xsd" generated="2014-11-30T21:50:42">
<Armor>
<ID>AR01</ID>
<Name>Robe</Name>
<Buy_x0020_Price>0</Buy_x0020_Price>
<Sell_x0020_Price>50</Sell_x0020_Price>
<STR>0</STR>
<MAG>0</MAG>
<END>5</END>
<AGI>0</AGI>
<ACC>0</ACC>
<Description>A robe used by travellers</Description>
</Armor>
<Armor>
<ID>AR02</ID>
<Name>Reinforced Robe</Name>
<Buy_x0020_Price>300</Buy_x0020_Price>
<Sell_x0020_Price>150</Sell_x0020_Price>
<STR>0</STR>
<MAG>0</MAG>
<END>15</END>
<AGI>0</AGI>
<ACC>0</ACC>
<Description>A robe made stronger using magic</Description>
</Armor>
<Armor>
<ID>AR03</ID>
<Name>Magician&apos;s Robe</Name>
<Buy_x0020_Price>1000</Buy_x0020_Price>
<Sell_x0020_Price>500</Sell_x0020_Price>
<STR>0</STR>
<MAG>10</MAG>
<END>30</END>
<AGI>0</AGI>
<ACC>0</ACC>
<Description>The robe that was worn by Royal Magicians</Description>
</Armor>
<Armor>
<ID>AR04</ID>
<Name>Sacred Garment</Name>
<Buy_x0020_Price>5000</Buy_x0020_Price>
<Sell_x0020_Price>2500</Sell_x0020_Price>
<STR>10</STR>
<MAG>25</MAG>
<END>50</END>
<AGI>10</AGI>
<ACC>5</ACC>
<Description>A Cloth blessed by the Goddess of Life</Description>
</Armor>
<Armor>
<ID>AR05</ID>
<Name>Leather Armor</Name>
<Buy_x0020_Price>0</Buy_x0020_Price>
<Sell_x0020_Price>50</Sell_x0020_Price>
<STR>0</STR>
<MAG>0</MAG>
<END>7</END>
<AGI>0</AGI>
<ACC>0</ACC>
<Description>An armor made of leather</Description>
</Armor>
<Armor>
<ID>AR06</ID>
<Name>Spike Armor</Name>
<Buy_x0020_Price>300</Buy_x0020_Price>
<Sell_x0020_Price>150</Sell_x0020_Price>
<STR>5</STR>
<MAG>0</MAG>
<END>15</END>
<AGI>0</AGI>
<ACC>0</ACC>
<Description>Iron armor with jutting spikes</Description>
</Armor>
<Armor>
<ID>AR07</ID>
<Name>Mithril Mail</Name>
<Buy_x0020_Price>1000</Buy_x0020_Price>
<Sell_x0020_Price>500</Sell_x0020_Price>
<STR>0</STR>
<MAG>0</MAG>
<END>30</END>
<AGI>0</AGI>
<ACC>0</ACC>
<Description>A very hard armor made from Mithril</Description>
</Armor>
<Armor>
<ID>AR08</ID>
<Name>King&apos;s Raiments</Name>
<Buy_x0020_Price>5000</Buy_x0020_Price>
<Sell_x0020_Price>2500</Sell_x0020_Price>
<STR>20</STR>
<MAG>10</MAG>
<END>60</END>
<AGI>5</AGI>
<ACC>10</ACC>
<Description>The armor used by kings</Description>
</Armor>
<Armor>
<ID>AR09</ID>
<Name>Paladin Armor</Name>
<Buy_x0020_Price>5000</Buy_x0020_Price>
<Sell_x0020_Price>2500</Sell_x0020_Price>
<STR>25</STR>
<MAG>0</MAG>
<END>70</END>
<AGI>0</AGI>
<ACC>5</ACC>
<Description>A sacred battle garb for Holy Knights</Description>
</Armor>
</dataroot>
